[
  {
    "filing_id": "0BRAFNG0000202220001716829",
    "politician_id": "0BRAMBR0000000000000000002",
    "regime_id": "0BRAREG0000000000000000001",
    "instrument_id": null,
    "asset_description_raw": "1500 QUOTAS DE CAPITAL NA EMPRESA BUTIQUE DO CONDOMINIO LTDA - CNPJ: 05082075/0001-82.",
    "record_type": "holding",
    "asset_class": "private",
    "side": null,
    "transaction_date": null,
    "as_of_date": "2022-10-02",
    "notified_date": null,
    "value": { "low": "1500.00", "high": "1500.00", "currency": "BRL" },
    "owner": null,
    "extraction_confidence": 1.0,
    "extracted_by": "br_bem_candidato/csv@1",
    "fingerprint": null,
    "details": {
      "asset_type_code_raw": "32",
      "asset_type_label_raw": "Quotas ou quinhões de capital",
      "asset_class": "private",
      "asset_description_raw": "1500 QUOTAS DE CAPITAL NA EMPRESA BUTIQUE DO CONDOMINIO LTDA - CNPJ: 05082075/0001-82.",
      "value_raw": "1500,00",
      "election_year": 2022,
      "line_item_ordinal": 1,
      "last_updated_date_raw": "13/05/2026",
      "last_updated_time_raw": "16:24:17"
    }
  },
  {
    "filing_id": "0BRAFNG0000202220001716829",
    "politician_id": "0BRAMBR0000000000000000002",
    "regime_id": "0BRAREG0000000000000000001",
    "instrument_id": null,
    "asset_description_raw": "SALDO EM VGBL - CAIXA VIDA E PREVIDENCIA S/A - CNPJ: 03.730.204/0001-76",
    "record_type": "holding",
    "asset_class": "other",
    "side": null,
    "transaction_date": null,
    "as_of_date": "2022-10-02",
    "notified_date": null,
    "value": { "low": "5300.00", "high": "5300.00", "currency": "BRL" },
    "owner": null,
    "extraction_confidence": 1.0,
    "extracted_by": "br_bem_candidato/csv@1",
    "fingerprint": null,
    "details": {
      "asset_type_code_raw": "97",
      "asset_type_label_raw": "VGBL - Vida Gerador de Benefício Livre",
      "asset_class": "other",
      "asset_description_raw": "SALDO EM VGBL - CAIXA VIDA E PREVIDENCIA S/A - CNPJ: 03.730.204/0001-76",
      "value_raw": "5300,00",
      "election_year": 2022,
      "line_item_ordinal": 2,
      "last_updated_date_raw": "13/05/2026",
      "last_updated_time_raw": "16:24:17"
    }
  },
  {
    "filing_id": "0BRAFNG0000202220001716829",
    "politician_id": "0BRAMBR0000000000000000002",
    "regime_id": "0BRAREG0000000000000000001",
    "instrument_id": null,
    "asset_description_raw": "SALDO EM VGBL - SAFRA VIDA E PREVIDENCIA - CNPJ: 30.902.142/0001-05",
    "record_type": "holding",
    "asset_class": "other",
    "side": null,
    "transaction_date": null,
    "as_of_date": "2022-10-02",
    "notified_date": null,
    "value": { "low": "8213.04", "high": "8213.04", "currency": "BRL" },
    "owner": null,
    "extraction_confidence": 1.0,
    "extracted_by": "br_bem_candidato/csv@1",
    "fingerprint": null,
    "details": {
      "asset_type_code_raw": "97",
      "asset_type_label_raw": "VGBL - Vida Gerador de Benefício Livre",
      "asset_class": "other",
      "asset_description_raw": "SALDO EM VGBL - SAFRA VIDA E PREVIDENCIA - CNPJ: 30.902.142/0001-05",
      "value_raw": "8213,04",
      "election_year": 2022,
      "line_item_ordinal": 3,
      "last_updated_date_raw": "13/05/2026",
      "last_updated_time_raw": "16:24:17"
    }
  }
]
