[
  {
    "filing_id": "0BRAFNG0000202210001595344",
    "politician_id": "0BRAMBR0000000000000000001",
    "regime_id": "0BRAREG0000000000000000001",
    "instrument_id": null,
    "asset_description_raw": "Moto Modelo Broz - Honda ano 2019/2020",
    "record_type": "holding",
    "asset_class": "other",
    "side": null,
    "transaction_date": null,
    "as_of_date": "2022-10-02",
    "notified_date": null,
    "value": { "low": "15000.00", "high": "15000.00", "currency": "BRL" },
    "owner": null,
    "extraction_confidence": 1.0,
    "extracted_by": "br_bem_candidato/csv@1",
    "fingerprint": null,
    "details": {
      "asset_type_code_raw": "21",
      "asset_type_label_raw": "Veículo automotor terrestre: caminhão, automóvel, moto, etc.",
      "asset_class": "other",
      "asset_description_raw": "Moto Modelo Broz - Honda ano 2019/2020",
      "value_raw": "15000,00",
      "election_year": 2022,
      "line_item_ordinal": 3,
      "last_updated_date_raw": "02/10/2022",
      "last_updated_time_raw": "23:21:28"
    }
  },
  {
    "filing_id": "0BRAFNG0000202210001595344",
    "politician_id": "0BRAMBR0000000000000000001",
    "regime_id": "0BRAREG0000000000000000001",
    "instrument_id": null,
    "asset_description_raw": "Casa na zona rural de xapuri",
    "record_type": "holding",
    "asset_class": "real_estate",
    "side": null,
    "transaction_date": null,
    "as_of_date": "2022-10-02",
    "notified_date": null,
    "value": { "low": "10000.00", "high": "10000.00", "currency": "BRL" },
    "owner": null,
    "extraction_confidence": 1.0,
    "extracted_by": "br_bem_candidato/csv@1",
    "fingerprint": null,
    "details": {
      "asset_type_code_raw": "12",
      "asset_type_label_raw": "Casa",
      "asset_class": "real_estate",
      "asset_description_raw": "Casa na zona rural de xapuri",
      "value_raw": "10000,00",
      "election_year": 2022,
      "line_item_ordinal": 1,
      "last_updated_date_raw": "02/10/2022",
      "last_updated_time_raw": "23:21:28"
    }
  },
  {
    "filing_id": "0BRAFNG0000202210001595344",
    "politician_id": "0BRAMBR0000000000000000001",
    "regime_id": "0BRAREG0000000000000000001",
    "instrument_id": null,
    "asset_description_raw": "imovel rural ramal do recanto do equador",
    "record_type": "holding",
    "asset_class": "real_estate",
    "side": null,
    "transaction_date": null,
    "as_of_date": "2022-10-02",
    "notified_date": null,
    "value": { "low": "900000.00", "high": "900000.00", "currency": "BRL" },
    "owner": null,
    "extraction_confidence": 1.0,
    "extracted_by": "br_bem_candidato/csv@1",
    "fingerprint": null,
    "details": {
      "asset_type_code_raw": "13",
      "asset_type_label_raw": "Terreno",
      "asset_class": "real_estate",
      "asset_description_raw": "imovel rural ramal do recanto do equador",
      "value_raw": "900000,00",
      "election_year": 2022,
      "line_item_ordinal": 2,
      "last_updated_date_raw": "02/10/2022",
      "last_updated_time_raw": "23:21:28"
    }
  }
]
