[
  {
    "filing_id": "0CACFNG00000000000C7BF3DA3",
    "politician_id": "0CACMBR0000000000000000004",
    "regime_id": "0CACREG0000000000000000001",
    "instrument_id": null,
    "asset_description_raw": "Date of change: 2025/07/22 I am now President and Secretary of 9546-0796 Quebec Inc., St-Georges, Quebec",
    "record_type": "change_notification",
    "asset_class": "other",
    "side": null,
    "transaction_date": null,
    "as_of_date": null,
    "notified_date": "2026-06-26",
    "value": null,
    "owner": "self",
    "extraction_confidence": 1.0,
    "extracted_by": "canada_ciec/html@1",
    "fingerprint": null,
    "details": {
      "declaration_id": "c7bf3da3-9669-f111-81a9-001dd8b72449",
      "row_ordinal": 1,
      "item_id": "C3BBBA6D-9D70-F111-81AB-001DD8B72449",
      "section_label": "Activities",
      "declaration_type_raw": "Material Changes",
      "law": "code",
      "h1_title": "Notice of Material Change",
      "client_id": "f0f4e0ff-7b2a-f011-8195-001dd8b72449",
      "client_title": "Member of Parliament",
      "no_longer_applicable": false,
      "ociec_translation": false,
      "language": "en",
      "gift_received_date": null,
      "gift_source": null,
      "gift_circumstance": null,
      "travel_destination": null,
      "travel_sponsor": null,
      "travel_dates_raw": null,
      "travel_start": null,
      "travel_end": null,
      "fields": {},
      "date_of_change": "2025-07-22"
    }
  },
  {
    "filing_id": "0CACFNG00000000000C7BF3DA3",
    "politician_id": "0CACMBR0000000000000000004",
    "regime_id": "0CACREG0000000000000000001",
    "instrument_id": null,
    "asset_description_raw": "Date of change: 2025/07/22 Corporation affiliated with 9488-7437 Quebec Inc., operating as Tradition Famille Groleau: - 9546-0796 Quebec Inc., Saint-Georges, Quebec",
    "record_type": "change_notification",
    "asset_class": "other",
    "side": null,
    "transaction_date": null,
    "as_of_date": null,
    "notified_date": "2026-06-26",
    "value": null,
    "owner": "self",
    "extraction_confidence": 1.0,
    "extracted_by": "canada_ciec/html@1",
    "fingerprint": null,
    "details": {
      "declaration_id": "c7bf3da3-9669-f111-81a9-001dd8b72449",
      "row_ordinal": 2,
      "item_id": "A26A4EA0-9D70-F111-81AB-001DD8B72449",
      "section_label": "INVESTMENT IN PRIVATE CORPORATIONS [Paragraph 24(1)(a)]",
      "declaration_type_raw": "Material Changes",
      "law": "code",
      "h1_title": "Notice of Material Change",
      "client_id": "f0f4e0ff-7b2a-f011-8195-001dd8b72449",
      "client_title": "Member of Parliament",
      "no_longer_applicable": false,
      "ociec_translation": false,
      "language": "en",
      "gift_received_date": null,
      "gift_source": null,
      "gift_circumstance": null,
      "travel_destination": null,
      "travel_sponsor": null,
      "travel_dates_raw": null,
      "travel_start": null,
      "travel_end": null,
      "fields": {},
      "date_of_change": "2025-07-22"
    }
  }
]
