[
  {
    "filing_id": "0CACFNG0000000000039E5BBFE",
    "politician_id": "0CACMBR0000000000000000003",
    "regime_id": "0CACREG0000000000000000001",
    "instrument_id": null,
    "asset_description_raw": "Member of the Board of Directors of 3H0 Foundation Society, a non-profit organization located in Vancouver, British Columbia",
    "record_type": "interest",
    "asset_class": "other",
    "side": null,
    "transaction_date": null,
    "as_of_date": null,
    "notified_date": "2025-10-07",
    "value": null,
    "owner": "self",
    "extraction_confidence": 1.0,
    "extracted_by": "canada_ciec/html@1",
    "fingerprint": null,
    "details": {
      "declaration_id": "39e5bbfe-5a8e-f011-819c-001dd8b72449",
      "row_ordinal": 1,
      "item_id": null,
      "section_label": null,
      "declaration_type_raw": "Outside Activities",
      "law": "act",
      "h1_title": "Public Declaration of Outside Activities",
      "client_id": "f30de0ad-2778-e511-bec6-002655368060",
      "client_title": "Secretary of State (International Development)",
      "no_longer_applicable": false,
      "ociec_translation": false,
      "language": "en",
      "gift_received_date": null,
      "gift_source": null,
      "gift_circumstance": null,
      "travel_destination": null,
      "travel_sponsor": null,
      "travel_dates_raw": null,
      "travel_start": null,
      "travel_end": null,
      "fields": {}
    }
  }
]
