[
  {
    "filing_id": "0HSEFNG0000000000020034836",
    "politician_id": "0HSEMBR0000000000000000004",
    "regime_id": "0HSEREG0000000000000000001",
    "instrument_id": null,
    "asset_description_raw": "Intel Corporation - Common Stock (INTC) [OP]",
    "record_type": "transaction",
    "asset_class": "option",
    "side": "buy",
    "transaction_date": "2026-05-29",
    "as_of_date": null,
    "notified_date": "2026-05-29",
    "value": { "low": "1000001.00", "high": "5000000.00", "currency": "USD" },
    "owner": "spouse",
    "extraction_confidence": 0.9800000190734863,
    "extracted_by": "us_house_ptr/text@1",
    "fingerprint": null,
    "details": {
      "doc_id": "20034836",
      "row_ordinal": 1,
      "row_id": null,
      "asset_type_code": "OP",
      "amount_band_raw": "$1,000,001 - $5,000,000",
      "transaction_type_raw": "P",
      "partial_sale": false,
      "cap_gains_over_200": null,
      "filing_status_raw": "New",
      "owner_source": "row",
      "subholding_of": null,
      "vehicle_owner_code": null,
      "vehicle_location": null,
      "description": "Purchased 200 call options with a strike price of $50 and an expiration date of 3/19/27.",
      "comments": null,
      "signed_date": "2026-06-23"
    }
  },
  {
    "filing_id": "0HSEFNG0000000000020034836",
    "politician_id": "0HSEMBR0000000000000000004",
    "regime_id": "0HSEREG0000000000000000001",
    "instrument_id": null,
    "asset_description_raw": "Uber Technologies, Inc. Common Stock (UBER) [OP]",
    "record_type": "transaction",
    "asset_class": "option",
    "side": "buy",
    "transaction_date": "2026-05-29",
    "as_of_date": null,
    "notified_date": "2026-05-29",
    "value": { "low": "500001.00", "high": "1000000.00", "currency": "USD" },
    "owner": "spouse",
    "extraction_confidence": 0.9800000190734863,
    "extracted_by": "us_house_ptr/text@1",
    "fingerprint": null,
    "details": {
      "doc_id": "20034836",
      "row_ordinal": 2,
      "row_id": null,
      "asset_type_code": "OP",
      "amount_band_raw": "$500,001 - $1,000,000",
      "transaction_type_raw": "P",
      "partial_sale": false,
      "cap_gains_over_200": null,
      "filing_status_raw": "New",
      "owner_source": "row",
      "subholding_of": null,
      "vehicle_owner_code": null,
      "vehicle_location": null,
      "description": "Purchased 200 call options with a strike price of $50 and an expiration date of 3/19/27.",
      "comments": null,
      "signed_date": "2026-06-23"
    }
  }
]
