[
  {
    "filing_id": "0SENFNG000000000004AA0094D",
    "politician_id": "0SENMBR0000000000000000002",
    "regime_id": "0SENREG0000000000000000001",
    "instrument_id": null,
    "asset_description_raw": "Oracle Corporation Common Stock",
    "record_type": "transaction",
    "asset_class": "equity",
    "side": "sell",
    "transaction_date": "2026-05-07",
    "as_of_date": null,
    "notified_date": null,
    "value": { "low": "15001.00", "high": "50000.00", "currency": "USD" },
    "owner": "self",
    "extraction_confidence": 1.0,
    "extracted_by": "us_senate_ptr/html@1",
    "fingerprint": null,
    "details": {
      "report_uuid": "4aa0094d-d9da-4a05-aa13-6d9f5d376105",
      "row_ordinal": 1,
      "row_number": "3",
      "ticker": "ORCL",
      "asset_type_raw": "Stock",
      "asset_detail": null,
      "amount_band_raw": "$15,001 - $50,000",
      "transaction_type_raw": "Sale (Partial)",
      "partial_sale": true,
      "comment": null,
      "amendment_number": null,
      "filed_at_raw": "06/02/2026 @ 12:56 PM"
    }
  },
  {
    "filing_id": "0SENFNG000000000004AA0094D",
    "politician_id": "0SENMBR0000000000000000002",
    "regime_id": "0SENREG0000000000000000001",
    "instrument_id": null,
    "asset_description_raw": "NVIDIA Corporation - Common Stock",
    "record_type": "transaction",
    "asset_class": "equity",
    "side": "sell",
    "transaction_date": "2026-05-08",
    "as_of_date": null,
    "notified_date": null,
    "value": { "low": "100001.00", "high": "250000.00", "currency": "USD" },
    "owner": "self",
    "extraction_confidence": 1.0,
    "extracted_by": "us_senate_ptr/html@1",
    "fingerprint": null,
    "details": {
      "report_uuid": "4aa0094d-d9da-4a05-aa13-6d9f5d376105",
      "row_ordinal": 2,
      "row_number": "2",
      "ticker": "NVDA",
      "asset_type_raw": "Stock",
      "asset_detail": null,
      "amount_band_raw": "$100,001 - $250,000",
      "transaction_type_raw": "Sale (Partial)",
      "partial_sale": true,
      "comment": null,
      "amendment_number": null,
      "filed_at_raw": "06/02/2026 @ 12:56 PM"
    }
  },
  {
    "filing_id": "0SENFNG000000000004AA0094D",
    "politician_id": "0SENMBR0000000000000000002",
    "regime_id": "0SENREG0000000000000000001",
    "instrument_id": null,
    "asset_description_raw": "NVIDIA Corporation - Common Stock",
    "record_type": "transaction",
    "asset_class": "equity",
    "side": "sell",
    "transaction_date": "2026-05-08",
    "as_of_date": null,
    "notified_date": null,
    "value": { "low": "100001.00", "high": "250000.00", "currency": "USD" },
    "owner": "spouse",
    "extraction_confidence": 1.0,
    "extracted_by": "us_senate_ptr/html@1",
    "fingerprint": null,
    "details": {
      "report_uuid": "4aa0094d-d9da-4a05-aa13-6d9f5d376105",
      "row_ordinal": 3,
      "row_number": "1",
      "ticker": "NVDA",
      "asset_type_raw": "Stock",
      "asset_detail": null,
      "amount_band_raw": "$100,001 - $250,000",
      "transaction_type_raw": "Sale (Partial)",
      "partial_sale": true,
      "comment": null,
      "amendment_number": null,
      "filed_at_raw": "06/02/2026 @ 12:56 PM"
    }
  }
]
