[
  {
    "filing_id": "0DEBFNG0000000000000000001",
    "politician_id": "0DEBMBR0000000000000000001",
    "regime_id": "0DEBREG0000000000000000001",
    "instrument_id": null,
    "asset_description_raw": "THSB Throm Hauser Strobl von Berlichingen Rechtsanwälte PartGmbB, Heilbronn — Rechtsanwalt",
    "record_type": "interest",
    "asset_class": "other",
    "side": null,
    "transaction_date": null,
    "as_of_date": null,
    "notified_date": null,
    "value": {
      "low": "1000.00",
      "high": "1000.00",
      "currency": "EUR"
    },
    "owner": "self",
    "extraction_confidence": 1.0,
    "extracted_by": "de_bundestag/html@1",
    "fingerprint": null,
    "details": {
      "mdb_id": 1049290,
      "wahlperiode": 21,
      "category_number": 2,
      "category_name": "Entgeltliche Tätigkeiten neben dem Mandat",
      "row_ordinal": 1,
      "entry_text": "THSB Throm Hauser Strobl von Berlichingen Rechtsanwälte PartGmbB, Heilbronn — Rechtsanwalt",
      "amount_raw": "monatlich, 1.000,00 EUR, Gewinnausschüttung",
      "period": "monthly",
      "amount_year": null,
      "partner": "Mandant 3, Formenbau, 2025; Mandant 5, Energieversorgungsunternehmen, 2025; 2026; Mandant 28, Holzbau, 2025; 2026; Mandant 33, Wohnbau, 2026; Mandant 65, Fenster- und Fassadenbau, 2025; Mandant 67, Privatperson, 2025; 2026",
      "profit_before_tax": false,
      "non_quantifiable": false,
      "ehrenamtlich": false,
      "language": "de",
      "value_source": "betragsgenau"
    }
  },
  {
    "filing_id": "0DEBFNG0000000000000000001",
    "politician_id": "0DEBMBR0000000000000000001",
    "regime_id": "0DEBREG0000000000000000001",
    "instrument_id": null,
    "asset_description_raw": "HMI Forderungs Treuhand GmbH, Heilbronn",
    "record_type": "interest",
    "asset_class": "equity",
    "side": null,
    "transaction_date": null,
    "as_of_date": null,
    "notified_date": null,
    "value": null,
    "owner": "self",
    "extraction_confidence": 1.0,
    "extracted_by": "de_bundestag/html@1",
    "fingerprint": null,
    "details": {
      "mdb_id": 1049290,
      "wahlperiode": 21,
      "category_number": 7,
      "category_name": "Beteiligungen an Kapital- oder Personengesellschaften",
      "row_ordinal": 2,
      "entry_text": "HMI Forderungs Treuhand GmbH, Heilbronn",
      "amount_raw": null,
      "period": null,
      "amount_year": null,
      "partner": null,
      "profit_before_tax": false,
      "non_quantifiable": false,
      "ehrenamtlich": false,
      "language": "de",
      "value_source": "none"
    }
  },
  {
    "filing_id": "0DEBFNG0000000000000000001",
    "politician_id": "0DEBMBR0000000000000000001",
    "regime_id": "0DEBREG0000000000000000001",
    "instrument_id": null,
    "asset_description_raw": "THSB Throm Hauser Strobl von Berlichingen Rechtsanwälte PartGmbB, Heilbronn — Bezüglich der Einkünfte aus dieser Beteiligung wird auf die bereits als Einkünfte aus entgeltlichen Nebentätigkeiten veröffentlichten Beträge verwiesen.",
    "record_type": "interest",
    "asset_class": "equity",
    "side": null,
    "transaction_date": null,
    "as_of_date": null,
    "notified_date": null,
    "value": null,
    "owner": "self",
    "extraction_confidence": 1.0,
    "extracted_by": "de_bundestag/html@1",
    "fingerprint": null,
    "details": {
      "mdb_id": 1049290,
      "wahlperiode": 21,
      "category_number": 7,
      "category_name": "Beteiligungen an Kapital- oder Personengesellschaften",
      "row_ordinal": 3,
      "entry_text": "THSB Throm Hauser Strobl von Berlichingen Rechtsanwälte PartGmbB, Heilbronn — Bezüglich der Einkünfte aus dieser Beteiligung wird auf die bereits als Einkünfte aus entgeltlichen Nebentätigkeiten veröffentlichten Beträge verwiesen.",
      "amount_raw": null,
      "period": null,
      "amount_year": null,
      "partner": null,
      "profit_before_tax": false,
      "non_quantifiable": false,
      "ehrenamtlich": false,
      "language": "de",
      "value_source": "none"
    }
  }
]
